{"allowed_exercise_types":["reading","matching","speaking"],"content_sections":[{"body":"Use this lesson language to communicate a simple real-life meaning: Combine family, possession, place, and polite welcome language. Model: “Welcome to our flat. My parents have a small room near the kitchen.” Notice the important words and the word order. Mẹo tiếng Việt: hãy hiểu ý của cả câu trước, rồi nói theo cụm ngắn; không cần dịch từng từ.","id":"form-and-meaning","section_type":"explanation","target_ids":["a1t_u03_home_language_review","a1t_u03_describing_a_room","a1t_u03_family_words"],"title":"Form and meaning"},{"body":"Read this short situation. A learner needs to use a home tour clearly and politely. One useful response is: “Welcome to our flat. My parents have a small room near the kitchen.” Say the model once, then change one safe detail such as a name, place, time, colour, or item when the meaning allows.","id":"guided-context","section_type":"dialogue","target_ids":["a1t_u03_home_language_review","a1t_u03_describing_a_room","a1t_u03_family_words"],"title":"Guided context"},{"body":"Practise for meaning, not only for memory. Imagine one everyday situation where a home tour is useful. First use the model, then make one small change. Check: Is the message clear? Is the target language in the right place? Can another person answer you?","id":"use-it","section_type":"review","target_ids":["a1t_u03_home_language_review","a1t_u03_describing_a_room","a1t_u03_family_words"],"title":"Use it"}],"content_status":"UNREVIEWED","duration_minutes":30,"exercises":[{"id":"detail-check","media_required":false,"prompt":"Read the short message and answer the question about a home tour.","questions":[{"acceptable_answers":["the speaker's family flat"],"question":"Whose flat is it?"}],"stimulus":"Welcome to our flat. My parents have a small room near the kitchen.","target_ids":["a1t_u03_home_language_review"],"type":"reading"},{"id":"form-match","media_required":false,"pairs":[{"left":"Welcome to our flat. My parents have a small room near the kitchen.","right":"A model sentence for a home tour."},{"left":"A Home Tour","right":"The everyday situation for this lesson."}],"prompt":"Match each useful English expression with its practical use in a home tour.","target_ids":["a1t_u03_home_language_review"],"type":"matching"},{"id":"personal-response","media_required":false,"prompt":"Make a short, personal response about a home tour. Use the lesson language and add one detail that is yours.","rubric":{"criteria":["The response communicates a clear meaning about a home tour.","The response uses the allocated language in an understandable form.","The response adds an appropriate personal or invented detail."]},"target_ids":["a1t_u03_home_language_review","a1t_u03_describing_a_room","a1t_u03_family_words"],"type":"speaking"}],"language_focus":"Combine family, possession, place, and polite welcome language.","lesson_id":"m16a1-v1-a1-u03-l05","objective_target_ids":["a1t_u03_home_language_review","a1t_u03_describing_a_room","a1t_u03_family_words"],"objectives":["Combine family, possession, place, and polite welcome language.","Use home-language review in one short, clear everyday exchange."],"outline_targets":[{"dimension":"grammar","node_id":"kg_a1_1_grammar"},{"dimension":"vocabulary_senses","node_id":"kg_a1_1_vocabulary_senses"},{"dimension":"functions","node_id":"kg_a1_1_functions"},{"dimension":"pronunciation","node_id":"kg_a1_1_pronunciation"},{"dimension":"discourse","node_id":"kg_a1_1_discourse"},{"dimension":"pragmatics","node_id":"kg_a1_1_pragmatics"},{"dimension":"collocations","node_id":"kg_a1_1_collocations"},{"dimension":"lexical_chunks","node_id":"kg_a1_1_lexical_chunks"},{"dimension":"topics","node_id":"kg_a1_1_topics"},{"dimension":"skills","node_id":"kg_a1_1_skills"}],"packet_id":"a1full-packet-15","packet_sha256":"ecb641835fe7432297973840d6869860376a966a56fa764f0cd3f7c98e74da99","practice":{"listening":{"answer":"in the kitchen","constraints":["Do not reveal the transcript before the learner answers.","Ask exactly one comprehension question before showing the transcript.","Use only the supplied project-authored transcript."],"goal":"Understand one clear detail in a short exchange about a home tour.","instruction":"Listen once without reading to a short exchange about a home tour. Answer the question, then ask to see the transcript and listen again.","media_required":false,"question":"Where does the mother have tea?","target_ids":["a1t_u03_home_language_review","a1t_u03_describing_a_room","a1t_u03_family_words"],"transcript":"Welcome to our home. My mother has tea in the kitchen."},"pronunciation":{"constraints":["Assess pronunciation only when learner audio is available.","Return NOT_ASSESSED when no audio is supplied.","Give one observable sound, stress, or rhythm point rather than general pronunciation advice."],"goal":"Produce the identified sound, stress, or rhythm feature clearly in a useful phrase.","instruction":"Read the concrete sound target aloud: Use a friendly falling tone in Welcome, then stress HOME. Then read one lesson sentence slowly and once at normal speed.","target":"Use a friendly falling tone in Welcome, then stress HOME.","target_ids":["a1t_u03_home_language_review","a1t_u03_describing_a_room","a1t_u03_family_words"],"without_audio":"NOT_ASSESSED"},"speaking":{"constraints":["Give the tutor one role and the learner one role before the first turn.","Create an information gap: the tutor asks for one missing personal or practical detail.","Use no more than three tutor turns and give one correction only if it blocks meaning.","Finish after the learner has used the target and responded to one follow-up."],"goal":"Complete a short, understandable exchange about a home tour.","instruction":"Roleplay: you are a learner using a home tour; the tutor is a helpful conversation partner. Scenario: you need to use this language in a short everyday interaction. Tutor opening: “Hello. Can we practise a home tour?” Reply naturally, ask or answer one follow-up question, and finish the exchange politely. Useful model: Welcome to our flat. My parents have a small room near the kitchen.","target_ids":["a1t_u03_home_language_review","a1t_u03_describing_a_room","a1t_u03_family_words"]},"writing":{"constraints":["Wait for the learner draft before feedback.","Give at most two brief improvement points about meaning, word order, or target use.","Do not replace the learner draft with a complete rewritten answer."],"feedback_boundary":"FEEDBACK_ONLY_NO_REPLACEMENT","goal":"Produce a short A1 message about a home tour with a clear meaning.","instruction":"Write 2–3 short sentences for a real-life situation about a home tour. Include one sentence pattern from this lesson, then add one true or invented detail. Do not copy this model exactly: Welcome to our flat. My parents have a small room near the kitchen. Submit your draft first.","target_ids":["a1t_u03_home_language_review","a1t_u03_describing_a_room","a1t_u03_family_words"]}},"prerequisite_lesson_ids":["m16a1-v1-a1-u03-l04"],"provenance":{"allocation_sha256":"89223f95e61232e9261600c67021daa8328604cee89c9ad2b011368c1e035bda","blueprint_sha256":"9b993df9715ec8d4e75bed9458830b7e010e853bfac59894f8124359651fad17","content_manifest_sha256":"a4330865f885fa1b2074d4176f3b9470f3f3b82f56e792b061caad6e6782bed8","content_origin":"PROJECT_AUTHORED","content_unit_sha256":"46926df409d0bd509b6e4178c21a0cabe75583846647267a0ff6ea21443b64dc","population_sha256":"04316d931c16ce32e90dbfed123c8fd9d85fb3b01c4e1e22f310a672bfae9ea1"},"record_type":"a1_full_packet","schema_version":"2.0","sequence":15,"target_usage":[{"target_id":"a1t_u03_home_language_review","usage":"INTRODUCE"},{"target_id":"a1t_u03_describing_a_room","usage":"REQUIRE"},{"target_id":"a1t_u03_family_words","usage":"REVIEW"}],"tier":"A1.1","title":"A home tour","topic":"home-language review","unit_id":"m16a1-v1-a1-u03"}
