{"allowed_exercise_types":["listening","ordering","writing"],"content_sections":[{"body":"Use this lesson language to communicate a simple real-life meaning: Use can or cannot with a short direction step. Model: “You can walk to the bakery, but you cannot turn right at the bank.” Notice the important words and the word order. Mẹo tiếng Việt: hãy hiểu ý của cả câu trước, rồi nói theo cụm ngắn; không cần dịch từng từ.","id":"form-and-meaning","section_type":"explanation","target_ids":["a1t_u05_ability_and_directions","a1t_u05_simple_schedules"],"title":"Form and meaning"},{"body":"Read this short situation. A learner needs to use can you get there? clearly and politely. One useful response is: “You can walk to the bakery, but you cannot turn right at the bank.” Say the model once, then change one safe detail such as a name, place, time, colour, or item when the meaning allows.","id":"guided-context","section_type":"dialogue","target_ids":["a1t_u05_ability_and_directions","a1t_u05_simple_schedules"],"title":"Guided context"},{"body":"Practise for meaning, not only for memory. Imagine one everyday situation where can you get there? is useful. First use the model, then make one small change. Check: Is the message clear? Is the target language in the right place? Can another person answer you?","id":"use-it","section_type":"review","target_ids":["a1t_u05_ability_and_directions","a1t_u05_simple_schedules"],"title":"Use it"}],"content_status":"UNREVIEWED","duration_minutes":30,"exercises":[{"id":"detail-check","media_required":false,"prompt":"Read the short message and answer the question about can you get there?.","questions":[{"acceptable_answers":["to the bakery"],"question":"Where can you walk?"}],"stimulus":"You can walk to the bakery, but you cannot turn right at the bank.","target_ids":["a1t_u05_ability_and_directions"],"type":"listening"},{"correct_order":["You can walk to the bakery, but","you cannot turn right at the bank"],"id":"practice-order","items":["you cannot turn right at the bank","You can walk to the bakery, but"],"media_required":false,"prompt":"Put these two parts in a natural order to make a message about can you get there?.","target_ids":["a1t_u05_ability_and_directions"],"type":"ordering"},{"id":"personal-response","media_required":false,"prompt":"Make a short, personal response about can you get there?. Use the lesson language and add one detail that is yours.","rubric":{"criteria":["The response communicates a clear meaning about can you get there?.","The response uses the allocated language in an understandable form.","The response adds an appropriate personal or invented detail."]},"target_ids":["a1t_u05_ability_and_directions","a1t_u05_simple_schedules"],"type":"writing"}],"language_focus":"Use can or cannot with a short direction step.","lesson_id":"m16a1-v1-a1-u05-l04","objective_target_ids":["a1t_u05_ability_and_directions","a1t_u05_simple_schedules"],"objectives":["Use can or cannot with a short direction step.","Use ability and directions in one short, clear everyday exchange."],"outline_targets":[{"dimension":"grammar","node_id":"kg_a1_1_grammar"},{"dimension":"vocabulary_senses","node_id":"kg_a1_1_vocabulary_senses"},{"dimension":"functions","node_id":"kg_a1_1_functions"},{"dimension":"pronunciation","node_id":"kg_a1_1_pronunciation"},{"dimension":"discourse","node_id":"kg_a1_1_discourse"},{"dimension":"pragmatics","node_id":"kg_a1_1_pragmatics"},{"dimension":"collocations","node_id":"kg_a1_1_collocations"},{"dimension":"lexical_chunks","node_id":"kg_a1_1_lexical_chunks"},{"dimension":"topics","node_id":"kg_a1_1_topics"},{"dimension":"skills","node_id":"kg_a1_1_skills"}],"packet_id":"a1full-packet-24","packet_sha256":"f778b6dac5525255eef056e34e6ec770a199cde19fbccbb6cc89262bce3c1fcf","practice":{"listening":{"answer":"go straight to the park","constraints":["Do not reveal the transcript before the learner answers.","Ask exactly one comprehension question before showing the transcript.","Use only the supplied project-authored transcript."],"goal":"Understand one clear detail in a short exchange about can you get there?.","instruction":"Listen once without reading to a short exchange about can you get there?. Answer the question, then ask to see the transcript and listen again.","media_required":false,"question":"What can the listener do?","target_ids":["a1t_u05_ability_and_directions","a1t_u05_simple_schedules"],"transcript":"You can go straight to the park. You cannot park here."},"pronunciation":{"constraints":["Assess pronunciation only when learner audio is available.","Return NOT_ASSESSED when no audio is supplied.","Give one observable sound, stress, or rhythm point rather than general pronunciation advice."],"goal":"Produce the identified sound, stress, or rhythm feature clearly in a useful phrase.","instruction":"Read the concrete sound target aloud: Use weak can /kən/ in a statement; say cannot clearly in the negative. Then read one lesson sentence slowly and once at normal speed.","target":"Use weak can /kən/ in a statement; say cannot clearly in the negative.","target_ids":["a1t_u05_ability_and_directions","a1t_u05_simple_schedules"],"without_audio":"NOT_ASSESSED"},"speaking":{"constraints":["Give the tutor one role and the learner one role before the first turn.","Create an information gap: the tutor asks for one missing personal or practical detail.","Use no more than three tutor turns and give one correction only if it blocks meaning.","Finish after the learner has used the target and responded to one follow-up."],"goal":"Complete a short, understandable exchange about can you get there?.","instruction":"Roleplay: you are a learner using can you get there?; the tutor is a helpful conversation partner. Scenario: you need to use this language in a short everyday interaction. Tutor opening: “Hello. Can we practise can you get there??” Reply naturally, ask or answer one follow-up question, and finish the exchange politely. Useful model: You can walk to the bakery, but you cannot turn right at the bank.","target_ids":["a1t_u05_ability_and_directions","a1t_u05_simple_schedules"]},"writing":{"constraints":["Wait for the learner draft before feedback.","Give at most two brief improvement points about meaning, word order, or target use.","Do not replace the learner draft with a complete rewritten answer."],"feedback_boundary":"FEEDBACK_ONLY_NO_REPLACEMENT","goal":"Produce a short A1 message about can you get there? with a clear meaning.","instruction":"Write 2–3 short sentences for a real-life situation about can you get there?. Include one sentence pattern from this lesson, then add one true or invented detail. Do not copy this model exactly: You can walk to the bakery, but you cannot turn right at the bank. Submit your draft first.","target_ids":["a1t_u05_ability_and_directions","a1t_u05_simple_schedules"]}},"prerequisite_lesson_ids":["m16a1-v1-a1-u05-l03"],"provenance":{"allocation_sha256":"89223f95e61232e9261600c67021daa8328604cee89c9ad2b011368c1e035bda","blueprint_sha256":"9b993df9715ec8d4e75bed9458830b7e010e853bfac59894f8124359651fad17","content_manifest_sha256":"a4330865f885fa1b2074d4176f3b9470f3f3b82f56e792b061caad6e6782bed8","content_origin":"PROJECT_AUTHORED","content_unit_sha256":"aa4b62d4d2fae37f4e0eebd4d2c488d04e0a3cd090877c41537ef105ac629ac3","population_sha256":"04316d931c16ce32e90dbfed123c8fd9d85fb3b01c4e1e22f310a672bfae9ea1"},"record_type":"a1_full_packet","schema_version":"2.0","sequence":24,"target_usage":[{"target_id":"a1t_u05_ability_and_directions","usage":"INTRODUCE"},{"target_id":"a1t_u05_simple_schedules","usage":"PRACTISE"}],"tier":"A1.1","title":"Can you get there?","topic":"ability and directions","unit_id":"m16a1-v1-a1-u05"}
