{"allowed_exercise_types":["reading","matching","speaking"],"content_sections":[{"body":"In lesson 11: family words, notice this model: This is my sister. Her name is Anh. Keep the word order short and make the meaning clear.","id":"language-note","section_type":"explanation","target_ids":["a1t_u03_family_words"],"title":"Language focus"},{"body":"Read the original mini-context for lesson 11: family words: 'This is my sister. Her name is Anh.' Say which words carry the main information.","id":"context","section_type":"dialogue","target_ids":["a1t_u03_family_words","a1t_u02_adverbs_of_frequency"],"title":"Everyday context"}],"content_status":"UNREVIEWED","duration_minutes":35,"exercises":[{"id":"detail-check","media_required":false,"prompt":"Use the supplied original text for lesson 11: family words and answer one detail question.","questions":[{"acceptable_answers":["the speaker's sister"],"question":"Who is Anh?"}],"stimulus":"This is my sister. Her name is Anh.","target_ids":["a1t_u03_family_words"],"type":"reading"},{"id":"form-match","media_required":false,"pairs":[{"left":"Target phrase in People in my family","right":"This is my sister. Her name is Anh."},{"left":"Communication goal in lesson 11","right":"Use family nouns and possessive adjectives my, your, his, and her."}],"prompt":"Match the two lesson 11: family words cues with their meanings.","target_ids":["a1t_u03_family_words"],"type":"matching"},{"id":"personal-response","media_required":false,"prompt":"Give your own short speaking response for lesson 11: family words; use the target but do not copy the model.","rubric":{"criteria":["The response clearly addresses family words in lesson 11.","The response uses the allocated People in my family target intelligibly."]},"target_ids":["a1t_u03_family_words","a1t_u02_adverbs_of_frequency"],"type":"speaking"}],"language_focus":"Use family nouns and possessive adjectives my, your, his, and her.","lesson_id":"m16a1-v1-a1-u03-l01","objective_target_ids":["a1t_u03_family_words","a1t_u02_adverbs_of_frequency"],"objectives":["Use family nouns and possessive adjectives my, your, his, and her.","Use family words in one short, clear everyday exchange."],"outline_targets":[{"dimension":"grammar","node_id":"kg_a1_1_grammar"},{"dimension":"vocabulary_senses","node_id":"kg_a1_1_vocabulary_senses"},{"dimension":"functions","node_id":"kg_a1_1_functions"},{"dimension":"pronunciation","node_id":"kg_a1_1_pronunciation"},{"dimension":"discourse","node_id":"kg_a1_1_discourse"},{"dimension":"pragmatics","node_id":"kg_a1_1_pragmatics"},{"dimension":"collocations","node_id":"kg_a1_1_collocations"},{"dimension":"lexical_chunks","node_id":"kg_a1_1_lexical_chunks"},{"dimension":"topics","node_id":"kg_a1_1_topics"},{"dimension":"skills","node_id":"kg_a1_1_skills"}],"packet_id":"a1full-packet-11","packet_sha256":"afbd1243783cb52939dbdbc4ee6f085674299b31d54b9584e19ef90a61724e88","practice":{"listening":{"answer":"the speaker's sister","constraints":["Do not reveal the transcript before the learner answers.","Ask exactly one comprehension question.","Use only the supplied project-authored transcript."],"goal":"Identify one explicit detail about family words.","instruction":"Listen to the tutor read the lesson 11: family words transcript once. Answer one question before seeing the text.","media_required":false,"question":"Who is Anh?","target_ids":["a1t_u03_family_words","a1t_u02_adverbs_of_frequency"],"transcript":"This is my sister. Her name is Anh."},"pronunciation":{"constraints":["Assess pronunciation only when learner audio is available.","Return NOT_ASSESSED when no audio is supplied."],"goal":"Produce the selected family words words clearly.","instruction":"Read the target words for lesson 11: family words aloud, then compare clear final sounds and stress.","target":"sister, her","target_ids":["a1t_u03_family_words","a1t_u02_adverbs_of_frequency"],"without_audio":"NOT_ASSESSED"},"speaking":{"constraints":["Use at most two tutor turns.","Correct only one blocking error after the response."],"goal":"Use the family words language focus intelligibly.","instruction":"Take the learner role in a two-turn exchange about family words in lesson 11; respond with one or two short sentences.","target_ids":["a1t_u03_family_words","a1t_u02_adverbs_of_frequency"]},"writing":{"constraints":["Wait for the learner draft before giving feedback.","Do not replace the learner draft with a complete rewritten answer."],"feedback_boundary":"FEEDBACK_ONLY_NO_REPLACEMENT","goal":"Write a short A1 response about family words.","instruction":"Write two sentences about an invented family. For lesson 11: family words, submit your draft before receiving two brief improvement points.","target_ids":["a1t_u03_family_words","a1t_u02_adverbs_of_frequency"]}},"prerequisite_lesson_ids":["m16a1-v1-a1-u02-l05"],"provenance":{"allocation_sha256":"89223f95e61232e9261600c67021daa8328604cee89c9ad2b011368c1e035bda","blueprint_sha256":"9b993df9715ec8d4e75bed9458830b7e010e853bfac59894f8124359651fad17","content_manifest_sha256":"fda7b34c9da27141231dc40b0b5b424acb2469c20246d31e2afd3253009a66c0","content_origin":"PROJECT_AUTHORED","content_unit_sha256":"75c5e00a1cdb5f7616b68e9d7f55c167edc44e3ffc27c726f9e8cbf2268dbff9","population_sha256":"04316d931c16ce32e90dbfed123c8fd9d85fb3b01c4e1e22f310a672bfae9ea1"},"record_type":"a1_full_packet","schema_version":"2.0","sequence":11,"target_usage":[{"target_id":"a1t_u03_family_words","usage":"INTRODUCE"},{"target_id":"a1t_u02_adverbs_of_frequency","usage":"REQUIRE"}],"tier":"A1.1","title":"People in my family","topic":"family words","unit_id":"m16a1-v1-a1-u03"}
