{"allowed_exercise_types":["fill_blank","ordering","writing"],"content_sections":[{"body":"In lesson 30: present-simple integration, notice this model: I usually cook at home, but I eat with friends on Friday. Keep the word order short and make the meaning clear.","id":"language-note","section_type":"explanation","target_ids":["a1t_u06_present_simple_integration"],"title":"Language focus"},{"body":"Read the original mini-context for lesson 30: present-simple integration: 'I usually cook at home, but I eat with friends on Friday.' Say which words carry the main information.","id":"context","section_type":"dialogue","target_ids":["a1t_u06_present_simple_integration","a1t_u06_habit_frequency_review","a1t_u06_present_simple_statements"],"title":"Everyday context"}],"content_status":"UNREVIEWED","duration_minutes":35,"exercises":[{"acceptable_answers":["on Friday"],"id":"language-gap","media_required":false,"prompt":"Complete the key detail for lesson 30: present-simple integration: I usually cook at home, but I eat with friends ___.","target_ids":["a1t_u06_present_simple_integration"],"type":"fill_blank"},{"correct_order":["Notice the form in A balanced weekly routine","Read the model in lesson 30","Create a new present-simple integration example"],"id":"practice-order","items":["Read the model in lesson 30","Create a new present-simple integration example","Notice the form in A balanced weekly routine"],"media_required":false,"prompt":"Put the three learning steps for lesson 30: present-simple integration in a useful order.","target_ids":["a1t_u06_present_simple_integration"],"type":"ordering"},{"id":"personal-response","media_required":false,"prompt":"Give your own short writing response for lesson 30: present-simple integration; use the target but do not copy the model.","rubric":{"criteria":["The response clearly addresses present-simple integration in lesson 30.","The response uses the allocated A balanced weekly routine target intelligibly."]},"target_ids":["a1t_u06_present_simple_integration","a1t_u06_habit_frequency_review","a1t_u06_present_simple_statements"],"type":"writing"}],"language_focus":"Link several weekly habits with and, but, and because.","lesson_id":"m16a1-v1-a1-u06-l05","objective_target_ids":["a1t_u06_present_simple_integration","a1t_u06_habit_frequency_review","a1t_u06_present_simple_statements"],"objectives":["Link several weekly habits with and, but, and because.","Use present-simple integration in one short, clear everyday exchange."],"outline_targets":[{"dimension":"grammar","node_id":"kg_a1_2_grammar"},{"dimension":"vocabulary_senses","node_id":"kg_a1_2_vocabulary_senses"},{"dimension":"functions","node_id":"kg_a1_2_functions"},{"dimension":"pronunciation","node_id":"kg_a1_2_pronunciation"},{"dimension":"discourse","node_id":"kg_a1_2_discourse"},{"dimension":"pragmatics","node_id":"kg_a1_2_pragmatics"},{"dimension":"collocations","node_id":"kg_a1_2_collocations"},{"dimension":"lexical_chunks","node_id":"kg_a1_2_lexical_chunks"},{"dimension":"topics","node_id":"kg_a1_2_topics"},{"dimension":"skills","node_id":"kg_a1_2_skills"}],"packet_id":"a1full-packet-30","packet_sha256":"f388c588cc6d66733542d0136483f605875e9b320d4150839af4f38aedf02092","practice":{"listening":{"answer":"on Friday","constraints":["Do not reveal the transcript before the learner answers.","Ask exactly one comprehension question.","Use only the supplied project-authored transcript."],"goal":"Identify one explicit detail about present-simple integration.","instruction":"Listen to the tutor read the lesson 30: present-simple integration transcript once. Answer one question before seeing the text.","media_required":false,"question":"When does the speaker eat with friends?","target_ids":["a1t_u06_present_simple_integration","a1t_u06_habit_frequency_review","a1t_u06_present_simple_statements"],"transcript":"I usually cook at home, but I eat with friends on Friday."},"pronunciation":{"constraints":["Assess pronunciation only when learner audio is available.","Return NOT_ASSESSED when no audio is supplied."],"goal":"Produce the selected present-simple integration words clearly.","instruction":"Read the target words for lesson 30: present-simple integration aloud, then compare clear final sounds and stress.","target":"usually, Friday","target_ids":["a1t_u06_present_simple_integration","a1t_u06_habit_frequency_review","a1t_u06_present_simple_statements"],"without_audio":"NOT_ASSESSED"},"speaking":{"constraints":["Use at most two tutor turns.","Correct only one blocking error after the response."],"goal":"Use the present-simple integration language focus intelligibly.","instruction":"Take the learner role in a two-turn exchange about present-simple integration in lesson 30; respond with one or two short sentences.","target_ids":["a1t_u06_present_simple_integration","a1t_u06_habit_frequency_review","a1t_u06_present_simple_statements"]},"writing":{"constraints":["Wait for the learner draft before giving feedback.","Do not replace the learner draft with a complete rewritten answer."],"feedback_boundary":"FEEDBACK_ONLY_NO_REPLACEMENT","goal":"Write a short A1 response about present-simple integration.","instruction":"Write four linked routine sentences. For lesson 30: present-simple integration, submit your draft before receiving two brief improvement points.","target_ids":["a1t_u06_present_simple_integration","a1t_u06_habit_frequency_review","a1t_u06_present_simple_statements"]}},"prerequisite_lesson_ids":["m16a1-v1-a1-u06-l04"],"provenance":{"allocation_sha256":"89223f95e61232e9261600c67021daa8328604cee89c9ad2b011368c1e035bda","blueprint_sha256":"9b993df9715ec8d4e75bed9458830b7e010e853bfac59894f8124359651fad17","content_manifest_sha256":"fda7b34c9da27141231dc40b0b5b424acb2469c20246d31e2afd3253009a66c0","content_origin":"PROJECT_AUTHORED","content_unit_sha256":"e556979d4326bc7cd5a53238782170def66f15e48e0c86c91fabe3a45aa7585c","population_sha256":"04316d931c16ce32e90dbfed123c8fd9d85fb3b01c4e1e22f310a672bfae9ea1"},"record_type":"a1_full_packet","schema_version":"2.0","sequence":30,"target_usage":[{"target_id":"a1t_u06_present_simple_integration","usage":"INTRODUCE"},{"target_id":"a1t_u06_habit_frequency_review","usage":"REQUIRE"},{"target_id":"a1t_u06_present_simple_statements","usage":"REVIEW"}],"tier":"A1.2","title":"A balanced weekly routine","topic":"present-simple integration","unit_id":"m16a1-v1-a1-u06"}
