{"allowed_exercise_types":["fill_blank","ordering","writing"],"content_sections":[{"body":"Use this lesson language to communicate a simple real-life meaning: Use some in affirmative statements and any in simple questions. Model: “We have some eggs. Do we have any milk?” Notice the important words and the word order. Mẹo tiếng Việt: hãy hiểu ý của cả câu trước, rồi nói theo cụm ngắn; không cần dịch từng từ.","id":"form-and-meaning","section_type":"explanation","target_ids":["a1t_u04_basic_quantities","a1t_u04_meal_vocabulary"],"title":"Form and meaning"},{"body":"Read this short situation. A learner needs to use some and any clearly and politely. One useful response is: “We have some eggs. Do we have any milk?” Say the model once, then change one safe detail such as a name, place, time, colour, or item when the meaning allows.","id":"guided-context","section_type":"dialogue","target_ids":["a1t_u04_basic_quantities","a1t_u04_meal_vocabulary"],"title":"Guided context"},{"body":"Practise for meaning, not only for memory. Imagine one everyday situation where some and any is useful. First use the model, then make one small change. Check: Is the message clear? Is the target language in the right place? Can another person answer you?","id":"use-it","section_type":"review","target_ids":["a1t_u04_basic_quantities","a1t_u04_meal_vocabulary"],"title":"Use it"}],"content_status":"UNREVIEWED","duration_minutes":30,"exercises":[{"acceptable_answers":["some eggs"],"id":"language-gap","media_required":false,"prompt":"Complete the natural sentence about some and any: We have _____. Do we have any milk?","target_ids":["a1t_u04_basic_quantities"],"type":"fill_blank"},{"correct_order":["We have some eggs.","Do we have any milk"],"id":"practice-order","items":["Do we have any milk","We have some eggs."],"media_required":false,"prompt":"Put these two parts in a natural order to make a message about some and any.","target_ids":["a1t_u04_basic_quantities"],"type":"ordering"},{"id":"personal-response","media_required":false,"prompt":"Make a short, personal response about some and any. Use the lesson language and add one detail that is yours.","rubric":{"criteria":["The response communicates a clear meaning about some and any.","The response uses the allocated language in an understandable form.","The response adds an appropriate personal or invented detail."]},"target_ids":["a1t_u04_basic_quantities","a1t_u04_meal_vocabulary"],"type":"writing"}],"language_focus":"Use some in affirmative statements and any in simple questions.","lesson_id":"m16a1-v1-a1-u04-l03","objective_target_ids":["a1t_u04_basic_quantities","a1t_u04_meal_vocabulary"],"objectives":["Use some in affirmative statements and any in simple questions.","Use basic quantities in one short, clear everyday exchange."],"outline_targets":[{"dimension":"grammar","node_id":"kg_a1_1_grammar"},{"dimension":"vocabulary_senses","node_id":"kg_a1_1_vocabulary_senses"},{"dimension":"functions","node_id":"kg_a1_1_functions"},{"dimension":"pronunciation","node_id":"kg_a1_1_pronunciation"},{"dimension":"discourse","node_id":"kg_a1_1_discourse"},{"dimension":"pragmatics","node_id":"kg_a1_1_pragmatics"},{"dimension":"collocations","node_id":"kg_a1_1_collocations"},{"dimension":"lexical_chunks","node_id":"kg_a1_1_lexical_chunks"},{"dimension":"topics","node_id":"kg_a1_1_topics"},{"dimension":"skills","node_id":"kg_a1_1_skills"}],"packet_id":"a1full-packet-18","packet_sha256":"ab05bda3dfa65ba35c816af29e564e3e30327d9233b8780803e83cb02307703d","practice":{"listening":{"answer":"juice","constraints":["Do not reveal the transcript before the learner answers.","Ask exactly one comprehension question before showing the transcript.","Use only the supplied project-authored transcript."],"goal":"Understand one clear detail in a short exchange about some and any.","instruction":"Listen once without reading to a short exchange about some and any. Answer the question, then ask to see the transcript and listen again.","media_required":false,"question":"What do they ask about?","target_ids":["a1t_u04_basic_quantities","a1t_u04_meal_vocabulary"],"transcript":"We have some fruit. Do we have any juice?"},"pronunciation":{"constraints":["Assess pronunciation only when learner audio is available.","Return NOT_ASSESSED when no audio is supplied.","Give one observable sound, stress, or rhythm point rather than general pronunciation advice."],"goal":"Produce the identified sound, stress, or rhythm feature clearly in a useful phrase.","instruction":"Read the concrete sound target aloud: Contrast some /sʌm/ and any /ˈeni/. Then read one lesson sentence slowly and once at normal speed.","target":"Contrast some /sʌm/ and any /ˈeni/.","target_ids":["a1t_u04_basic_quantities","a1t_u04_meal_vocabulary"],"without_audio":"NOT_ASSESSED"},"speaking":{"constraints":["Give the tutor one role and the learner one role before the first turn.","Create an information gap: the tutor asks for one missing personal or practical detail.","Use no more than three tutor turns and give one correction only if it blocks meaning.","Finish after the learner has used the target and responded to one follow-up."],"goal":"Complete a short, understandable exchange about some and any.","instruction":"Roleplay: you are a learner using some and any; the tutor is a helpful conversation partner. Scenario: you need to use this language in a short everyday interaction. Tutor opening: “Hello. Can we practise some and any?” Reply naturally, ask or answer one follow-up question, and finish the exchange politely. Useful model: We have some eggs. Do we have any milk?","target_ids":["a1t_u04_basic_quantities","a1t_u04_meal_vocabulary"]},"writing":{"constraints":["Wait for the learner draft before feedback.","Give at most two brief improvement points about meaning, word order, or target use.","Do not replace the learner draft with a complete rewritten answer."],"feedback_boundary":"FEEDBACK_ONLY_NO_REPLACEMENT","goal":"Produce a short A1 message about some and any with a clear meaning.","instruction":"Write 2–3 short sentences for a real-life situation about some and any. Include one sentence pattern from this lesson, then add one true or invented detail. Do not copy this model exactly: We have some eggs. Do we have any milk? Submit your draft first.","target_ids":["a1t_u04_basic_quantities","a1t_u04_meal_vocabulary"]}},"prerequisite_lesson_ids":["m16a1-v1-a1-u04-l02"],"provenance":{"allocation_sha256":"89223f95e61232e9261600c67021daa8328604cee89c9ad2b011368c1e035bda","blueprint_sha256":"9b993df9715ec8d4e75bed9458830b7e010e853bfac59894f8124359651fad17","content_manifest_sha256":"a4330865f885fa1b2074d4176f3b9470f3f3b82f56e792b061caad6e6782bed8","content_origin":"PROJECT_AUTHORED","content_unit_sha256":"dc1a4174524b8189872fbc63bea411a3110559bd8c42a3c9b8b50393bfbe65b0","population_sha256":"04316d931c16ce32e90dbfed123c8fd9d85fb3b01c4e1e22f310a672bfae9ea1"},"record_type":"a1_full_packet","schema_version":"2.0","sequence":18,"target_usage":[{"target_id":"a1t_u04_basic_quantities","usage":"INTRODUCE"},{"target_id":"a1t_u04_meal_vocabulary","usage":"REQUIRE"}],"tier":"A1.1","title":"Some and any","topic":"basic quantities","unit_id":"m16a1-v1-a1-u04"}
