{"allowed_exercise_types":["fill_blank","ordering","writing"],"content_sections":[{"body":"In lesson 42: route language, notice this model: Take bus six, get off at King Street, and walk past the post office. Keep the word order short and make the meaning clear.","id":"language-note","section_type":"explanation","target_ids":["a1t_u09_route_language"],"title":"Language focus"},{"body":"Read the original mini-context for lesson 42: route language: 'Take bus six, get off at King Street, and walk past the post office.' Say which words carry the main information.","id":"context","section_type":"dialogue","target_ids":["a1t_u09_route_language","a1t_u09_transport_phrases"],"title":"Everyday context"}],"content_status":"UNREVIEWED","duration_minutes":35,"exercises":[{"acceptable_answers":["bus six"],"id":"language-gap","media_required":false,"prompt":"Complete the key detail for lesson 42: route language: Take ___, get off at King Street, and walk past the post office.","target_ids":["a1t_u09_route_language"],"type":"fill_blank"},{"correct_order":["Notice the form in Travel directions","Read the model in lesson 42","Create a new route language example"],"id":"practice-order","items":["Read the model in lesson 42","Create a new route language example","Notice the form in Travel directions"],"media_required":false,"prompt":"Put the three learning steps for lesson 42: route language in a useful order.","target_ids":["a1t_u09_route_language"],"type":"ordering"},{"id":"personal-response","media_required":false,"prompt":"Give your own short writing response for lesson 42: route language; use the target but do not copy the model.","rubric":{"criteria":["The response clearly addresses route language in lesson 42.","The response uses the allocated Travel directions target intelligibly."]},"target_ids":["a1t_u09_route_language","a1t_u09_transport_phrases"],"type":"writing"}],"language_focus":"Combine transport and direction steps in order.","lesson_id":"m16a1-v1-a1-u09-l02","objective_target_ids":["a1t_u09_route_language","a1t_u09_transport_phrases"],"objectives":["Combine transport and direction steps in order.","Use route language in one short, clear everyday exchange."],"outline_targets":[{"dimension":"grammar","node_id":"kg_a1_2_grammar"},{"dimension":"vocabulary_senses","node_id":"kg_a1_2_vocabulary_senses"},{"dimension":"functions","node_id":"kg_a1_2_functions"},{"dimension":"pronunciation","node_id":"kg_a1_2_pronunciation"},{"dimension":"discourse","node_id":"kg_a1_2_discourse"},{"dimension":"pragmatics","node_id":"kg_a1_2_pragmatics"},{"dimension":"collocations","node_id":"kg_a1_2_collocations"},{"dimension":"lexical_chunks","node_id":"kg_a1_2_lexical_chunks"},{"dimension":"topics","node_id":"kg_a1_2_topics"},{"dimension":"skills","node_id":"kg_a1_2_skills"}],"packet_id":"a1full-packet-42","packet_sha256":"12d9a38e64f5cd988f3e8f90ff78f377e5b4f5ec7abc1ef881d30f699a644e89","practice":{"listening":{"answer":"bus six","constraints":["Do not reveal the transcript before the learner answers.","Ask exactly one comprehension question.","Use only the supplied project-authored transcript."],"goal":"Identify one explicit detail about route language.","instruction":"Listen to the tutor read the lesson 42: route language transcript once. Answer one question before seeing the text.","media_required":false,"question":"Which bus should the traveller take?","target_ids":["a1t_u09_route_language","a1t_u09_transport_phrases"],"transcript":"Take bus six, get off at King Street, and walk past the post office."},"pronunciation":{"constraints":["Assess pronunciation only when learner audio is available.","Return NOT_ASSESSED when no audio is supplied."],"goal":"Produce the selected route language words clearly.","instruction":"Read the target words for lesson 42: route language aloud, then compare clear final sounds and stress.","target":"take, street","target_ids":["a1t_u09_route_language","a1t_u09_transport_phrases"],"without_audio":"NOT_ASSESSED"},"speaking":{"constraints":["Use at most two tutor turns.","Correct only one blocking error after the response."],"goal":"Use the route language language focus intelligibly.","instruction":"Take the learner role in a two-turn exchange about route language in lesson 42; respond with one or two short sentences.","target_ids":["a1t_u09_route_language","a1t_u09_transport_phrases"]},"writing":{"constraints":["Wait for the learner draft before giving feedback.","Do not replace the learner draft with a complete rewritten answer."],"feedback_boundary":"FEEDBACK_ONLY_NO_REPLACEMENT","goal":"Write a short A1 response about route language.","instruction":"Write three travel direction steps. For lesson 42: route language, submit your draft before receiving two brief improvement points.","target_ids":["a1t_u09_route_language","a1t_u09_transport_phrases"]}},"prerequisite_lesson_ids":["m16a1-v1-a1-u09-l01"],"provenance":{"allocation_sha256":"89223f95e61232e9261600c67021daa8328604cee89c9ad2b011368c1e035bda","blueprint_sha256":"9b993df9715ec8d4e75bed9458830b7e010e853bfac59894f8124359651fad17","content_manifest_sha256":"fda7b34c9da27141231dc40b0b5b424acb2469c20246d31e2afd3253009a66c0","content_origin":"PROJECT_AUTHORED","content_unit_sha256":"b99ae9e5f1102d1a46626839f110ace4b968059d67741130acf180a84fed431a","population_sha256":"04316d931c16ce32e90dbfed123c8fd9d85fb3b01c4e1e22f310a672bfae9ea1"},"record_type":"a1_full_packet","schema_version":"2.0","sequence":42,"target_usage":[{"target_id":"a1t_u09_route_language","usage":"INTRODUCE"},{"target_id":"a1t_u09_transport_phrases","usage":"PRACTISE"}],"tier":"A1.2","title":"Travel directions","topic":"route language","unit_id":"m16a1-v1-a1-u09"}
