{"allowed_exercise_types":["fill_blank","ordering","writing"],"content_sections":[{"body":"In lesson 50: integrated A1 review, notice this model: I usually shop every Friday. Yesterday I went late, so tomorrow I am going early. Keep the word order short and make the meaning clear.","id":"language-note","section_type":"explanation","target_ids":["a1t_u10_integrated_a1_review"],"title":"Language focus"},{"body":"Read the original mini-context for lesson 50: integrated A1 review: 'I usually shop every Friday. Yesterday I went late, so tomorrow I am going early.' Say which words carry the main information.","id":"context","section_type":"dialogue","target_ids":["a1t_u10_integrated_a1_review","a1t_u10_everyday_written_notes","a1t_u10_service_request_integration"],"title":"Everyday context"}],"content_status":"UNREVIEWED","duration_minutes":35,"exercises":[{"acceptable_answers":["every Friday"],"id":"language-gap","media_required":false,"prompt":"Complete the key detail for lesson 50: integrated A1 review: I usually shop ___. Yesterday I went late, so tomorrow I am going early.","target_ids":["a1t_u10_integrated_a1_review"],"type":"fill_blank"},{"correct_order":["Notice the form in A1 everyday challenge","Read the model in lesson 50","Create a new integrated A1 review example"],"id":"practice-order","items":["Read the model in lesson 50","Create a new integrated A1 review example","Notice the form in A1 everyday challenge"],"media_required":false,"prompt":"Put the three learning steps for lesson 50: integrated A1 review in a useful order.","target_ids":["a1t_u10_integrated_a1_review"],"type":"ordering"},{"id":"personal-response","media_required":false,"prompt":"Give your own short writing response for lesson 50: integrated A1 review; use the target but do not copy the model.","rubric":{"criteria":["The response clearly addresses integrated A1 review in lesson 50.","The response uses the allocated A1 everyday challenge target intelligibly."]},"target_ids":["a1t_u10_integrated_a1_review","a1t_u10_everyday_written_notes","a1t_u10_service_request_integration"],"type":"writing"}],"language_focus":"Combine a request, routine fact, past event, and future plan clearly.","lesson_id":"m16a1-v1-a1-u10-l05","objective_target_ids":["a1t_u10_integrated_a1_review","a1t_u10_everyday_written_notes","a1t_u10_service_request_integration"],"objectives":["Combine a request, routine fact, past event, and future plan clearly.","Use integrated A1 review in one short, clear everyday exchange."],"outline_targets":[{"dimension":"grammar","node_id":"kg_a1_2_grammar"},{"dimension":"vocabulary_senses","node_id":"kg_a1_2_vocabulary_senses"},{"dimension":"functions","node_id":"kg_a1_2_functions"},{"dimension":"pronunciation","node_id":"kg_a1_2_pronunciation"},{"dimension":"discourse","node_id":"kg_a1_2_discourse"},{"dimension":"pragmatics","node_id":"kg_a1_2_pragmatics"},{"dimension":"collocations","node_id":"kg_a1_2_collocations"},{"dimension":"lexical_chunks","node_id":"kg_a1_2_lexical_chunks"},{"dimension":"topics","node_id":"kg_a1_2_topics"},{"dimension":"skills","node_id":"kg_a1_2_skills"}],"packet_id":"a1full-packet-50","packet_sha256":"4005182e0ab8c57d5e92ae3e817213435e81e87fb565d40eadb9c58da52cba56","practice":{"listening":{"answer":"every Friday","constraints":["Do not reveal the transcript before the learner answers.","Ask exactly one comprehension question.","Use only the supplied project-authored transcript."],"goal":"Identify one explicit detail about integrated A1 review.","instruction":"Listen to the tutor read the lesson 50: integrated A1 review transcript once. Answer one question before seeing the text.","media_required":false,"question":"When does the speaker usually shop?","target_ids":["a1t_u10_integrated_a1_review","a1t_u10_everyday_written_notes","a1t_u10_service_request_integration"],"transcript":"I usually shop every Friday. Yesterday I went late, so tomorrow I am going early."},"pronunciation":{"constraints":["Assess pronunciation only when learner audio is available.","Return NOT_ASSESSED when no audio is supplied."],"goal":"Produce the selected integrated A1 review words clearly.","instruction":"Read the target words for lesson 50: integrated A1 review aloud, then compare clear final sounds and stress.","target":"usually, tomorrow","target_ids":["a1t_u10_integrated_a1_review","a1t_u10_everyday_written_notes","a1t_u10_service_request_integration"],"without_audio":"NOT_ASSESSED"},"speaking":{"constraints":["Use at most two tutor turns.","Correct only one blocking error after the response."],"goal":"Use the integrated A1 review language focus intelligibly.","instruction":"Take the learner role in a two-turn exchange about integrated A1 review in lesson 50; respond with one or two short sentences.","target_ids":["a1t_u10_integrated_a1_review","a1t_u10_everyday_written_notes","a1t_u10_service_request_integration"]},"writing":{"constraints":["Wait for the learner draft before giving feedback.","Do not replace the learner draft with a complete rewritten answer."],"feedback_boundary":"FEEDBACK_ONLY_NO_REPLACEMENT","goal":"Write a short A1 response about integrated A1 review.","instruction":"Write four linked sentences using familiar A1 language. For lesson 50: integrated A1 review, submit your draft before receiving two brief improvement points.","target_ids":["a1t_u10_integrated_a1_review","a1t_u10_everyday_written_notes","a1t_u10_service_request_integration"]}},"prerequisite_lesson_ids":["m16a1-v1-a1-u10-l04"],"provenance":{"allocation_sha256":"89223f95e61232e9261600c67021daa8328604cee89c9ad2b011368c1e035bda","blueprint_sha256":"9b993df9715ec8d4e75bed9458830b7e010e853bfac59894f8124359651fad17","content_manifest_sha256":"fda7b34c9da27141231dc40b0b5b424acb2469c20246d31e2afd3253009a66c0","content_origin":"PROJECT_AUTHORED","content_unit_sha256":"301f23ec8365237ab2413906bb33bdaf78e5a9b2db86d3d7e4f50e6e0335eafb","population_sha256":"04316d931c16ce32e90dbfed123c8fd9d85fb3b01c4e1e22f310a672bfae9ea1"},"record_type":"a1_full_packet","schema_version":"2.0","sequence":50,"target_usage":[{"target_id":"a1t_u10_integrated_a1_review","usage":"INTRODUCE"},{"target_id":"a1t_u10_everyday_written_notes","usage":"REQUIRE"},{"target_id":"a1t_u10_service_request_integration","usage":"REVIEW"}],"tier":"A1.2","title":"A1 everyday challenge","topic":"integrated A1 review","unit_id":"m16a1-v1-a1-u10"}
