{"allowed_exercise_types":["reading","matching","speaking"],"content_sections":[{"body":"Use this lesson language to communicate a simple real-life meaning: Use family nouns and possessive adjectives my, your, his, and her. Model: “This is my sister. Her name is Anh.” Notice the important words and the word order. Mẹo tiếng Việt: hãy hiểu ý của cả câu trước, rồi nói theo cụm ngắn; không cần dịch từng từ.","id":"form-and-meaning","section_type":"explanation","target_ids":["a1t_u03_family_words","a1t_u02_adverbs_of_frequency"],"title":"Form and meaning"},{"body":"Read this short situation. A learner needs to use people in my family clearly and politely. One useful response is: “This is my sister. Her name is Anh.” Say the model once, then change one safe detail such as a name, place, time, colour, or item when the meaning allows.","id":"guided-context","section_type":"dialogue","target_ids":["a1t_u03_family_words","a1t_u02_adverbs_of_frequency"],"title":"Guided context"},{"body":"Practise for meaning, not only for memory. Imagine one everyday situation where people in my family is useful. First use the model, then make one small change. Check: Is the message clear? Is the target language in the right place? Can another person answer you?","id":"use-it","section_type":"review","target_ids":["a1t_u03_family_words","a1t_u02_adverbs_of_frequency"],"title":"Use it"}],"content_status":"UNREVIEWED","duration_minutes":30,"exercises":[{"id":"detail-check","media_required":false,"prompt":"Read the short message and answer the question about people in my family.","questions":[{"acceptable_answers":["the speaker's sister"],"question":"Who is Anh?"}],"stimulus":"This is my sister. Her name is Anh.","target_ids":["a1t_u03_family_words"],"type":"reading"},{"id":"form-match","media_required":false,"pairs":[{"left":"This is my sister. Her name is Anh.","right":"A model sentence for people in my family."},{"left":"People In My Family","right":"The everyday situation for this lesson."}],"prompt":"Match each useful English expression with its practical use in people in my family.","target_ids":["a1t_u03_family_words"],"type":"matching"},{"id":"personal-response","media_required":false,"prompt":"Make a short, personal response about people in my family. Use the lesson language and add one detail that is yours.","rubric":{"criteria":["The response communicates a clear meaning about people in my family.","The response uses the allocated language in an understandable form.","The response adds an appropriate personal or invented detail."]},"target_ids":["a1t_u03_family_words","a1t_u02_adverbs_of_frequency"],"type":"speaking"}],"language_focus":"Use family nouns and possessive adjectives my, your, his, and her.","lesson_id":"m16a1-v1-a1-u03-l01","objective_target_ids":["a1t_u03_family_words","a1t_u02_adverbs_of_frequency"],"objectives":["Use family nouns and possessive adjectives my, your, his, and her.","Use family words in one short, clear everyday exchange."],"outline_targets":[{"dimension":"grammar","node_id":"kg_a1_1_grammar"},{"dimension":"vocabulary_senses","node_id":"kg_a1_1_vocabulary_senses"},{"dimension":"functions","node_id":"kg_a1_1_functions"},{"dimension":"pronunciation","node_id":"kg_a1_1_pronunciation"},{"dimension":"discourse","node_id":"kg_a1_1_discourse"},{"dimension":"pragmatics","node_id":"kg_a1_1_pragmatics"},{"dimension":"collocations","node_id":"kg_a1_1_collocations"},{"dimension":"lexical_chunks","node_id":"kg_a1_1_lexical_chunks"},{"dimension":"topics","node_id":"kg_a1_1_topics"},{"dimension":"skills","node_id":"kg_a1_1_skills"}],"packet_id":"a1full-packet-11","packet_sha256":"d984678222b39c58616b18f66a4d9405bf563eeb0ae6cc974269c95a4f836abc","practice":{"listening":{"answer":"the speaker's cousin","constraints":["Do not reveal the transcript before the learner answers.","Ask exactly one comprehension question before showing the transcript.","Use only the supplied project-authored transcript."],"goal":"Understand one clear detail in a short exchange about people in my family.","instruction":"Listen once without reading to a short exchange about people in my family. Answer the question, then ask to see the transcript and listen again.","media_required":false,"question":"Who is Mai?","target_ids":["a1t_u03_family_words","a1t_u02_adverbs_of_frequency"],"transcript":"This is my uncle. His daughter is my cousin, Mai."},"pronunciation":{"constraints":["Assess pronunciation only when learner audio is available.","Return NOT_ASSESSED when no audio is supplied.","Give one observable sound, stress, or rhythm point rather than general pronunciation advice."],"goal":"Produce the identified sound, stress, or rhythm feature clearly in a useful phrase.","instruction":"Read the concrete sound target aloud: Keep his and her short; stress COU-sin. Then read one lesson sentence slowly and once at normal speed.","target":"Keep his and her short; stress COU-sin.","target_ids":["a1t_u03_family_words","a1t_u02_adverbs_of_frequency"],"without_audio":"NOT_ASSESSED"},"speaking":{"constraints":["Give the tutor one role and the learner one role before the first turn.","Create an information gap: the tutor asks for one missing personal or practical detail.","Use no more than three tutor turns and give one correction only if it blocks meaning.","Finish after the learner has used the target and responded to one follow-up."],"goal":"Complete a short, understandable exchange about people in my family.","instruction":"Roleplay: you are a learner using people in my family; the tutor is a helpful conversation partner. Scenario: you need to use this language in a short everyday interaction. Tutor opening: “Hello. Can we practise people in my family?” Reply naturally, ask or answer one follow-up question, and finish the exchange politely. Useful model: This is my sister. Her name is Anh.","target_ids":["a1t_u03_family_words","a1t_u02_adverbs_of_frequency"]},"writing":{"constraints":["Wait for the learner draft before feedback.","Give at most two brief improvement points about meaning, word order, or target use.","Do not replace the learner draft with a complete rewritten answer."],"feedback_boundary":"FEEDBACK_ONLY_NO_REPLACEMENT","goal":"Produce a short A1 message about people in my family with a clear meaning.","instruction":"Write 2–3 short sentences for a real-life situation about people in my family. Include one sentence pattern from this lesson, then add one true or invented detail. Do not copy this model exactly: This is my sister. Her name is Anh. Submit your draft first.","target_ids":["a1t_u03_family_words","a1t_u02_adverbs_of_frequency"]}},"prerequisite_lesson_ids":["m16a1-v1-a1-u02-l05"],"provenance":{"allocation_sha256":"89223f95e61232e9261600c67021daa8328604cee89c9ad2b011368c1e035bda","blueprint_sha256":"9b993df9715ec8d4e75bed9458830b7e010e853bfac59894f8124359651fad17","content_manifest_sha256":"a4330865f885fa1b2074d4176f3b9470f3f3b82f56e792b061caad6e6782bed8","content_origin":"PROJECT_AUTHORED","content_unit_sha256":"46926df409d0bd509b6e4178c21a0cabe75583846647267a0ff6ea21443b64dc","population_sha256":"04316d931c16ce32e90dbfed123c8fd9d85fb3b01c4e1e22f310a672bfae9ea1"},"record_type":"a1_full_packet","schema_version":"2.0","sequence":11,"target_usage":[{"target_id":"a1t_u03_family_words","usage":"INTRODUCE"},{"target_id":"a1t_u02_adverbs_of_frequency","usage":"REQUIRE"}],"tier":"A1.1","title":"People in my family","topic":"family words","unit_id":"m16a1-v1-a1-u03"}
