{"allowed_exercise_types":["multiple_choice","matching","speaking"],"content_sections":[{"body":"Use this lesson language to communicate a simple real-life meaning: Use Hello, Hi, and Goodbye in short exchanges. Model: “Hello, I am Lan.” Notice the important words and the word order. Mẹo tiếng Việt: hãy hiểu ý của cả câu trước, rồi nói theo cụm ngắn; không cần dịch từng từ.","id":"form-and-meaning","section_type":"explanation","target_ids":["a1t_u01_social_greetings"],"title":"Form and meaning"},{"body":"Read this short situation. A learner needs to use hello and goodbye clearly and politely. One useful response is: “Hello, I am Lan.” Say the model once, then change one safe detail such as a name, place, time, colour, or item when the meaning allows.","id":"guided-context","section_type":"dialogue","target_ids":["a1t_u01_social_greetings"],"title":"Guided context"},{"body":"Practise for meaning, not only for memory. Imagine one everyday situation where hello and goodbye is useful. First use the model, then make one small change. Check: Is the message clear? Is the target language in the right place? Can another person answer you?","id":"use-it","section_type":"review","target_ids":["a1t_u01_social_greetings"],"title":"Use it"}],"content_status":"UNREVIEWED","duration_minutes":30,"exercises":[{"correct_answer":"Hello, I am Lan.","id":"meaning-check","media_required":false,"options":["Hello, I am Lan.","Hello, I am Lan. Please use the words in a different order.","Hello And Goodbye is an English sentence."],"prompt":"Choose the sentence that correctly uses the language for hello and goodbye.","target_ids":["a1t_u01_social_greetings"],"type":"multiple_choice"},{"id":"form-match","media_required":false,"pairs":[{"left":"Hello, I am Lan.","right":"A model sentence for hello and goodbye."},{"left":"Hello And Goodbye","right":"The everyday situation for this lesson."}],"prompt":"Match each useful English expression with its practical use in hello and goodbye.","target_ids":["a1t_u01_social_greetings"],"type":"matching"},{"id":"personal-response","media_required":false,"prompt":"Make a short, personal response about hello and goodbye. Use the lesson language and add one detail that is yours.","rubric":{"criteria":["The response communicates a clear meaning about hello and goodbye.","The response uses the allocated language in an understandable form.","The response adds an appropriate personal or invented detail."]},"target_ids":["a1t_u01_social_greetings"],"type":"speaking"}],"language_focus":"Use Hello, Hi, and Goodbye in short exchanges.","lesson_id":"m16a1-v1-a1-u01-l01","objective_target_ids":["a1t_u01_social_greetings"],"objectives":["Use Hello, Hi, and Goodbye in short exchanges.","Use social greetings in one short, clear everyday exchange."],"outline_targets":[{"dimension":"grammar","node_id":"kg_a1_1_grammar"},{"dimension":"vocabulary_senses","node_id":"kg_a1_1_vocabulary_senses"},{"dimension":"functions","node_id":"kg_a1_1_functions"},{"dimension":"pronunciation","node_id":"kg_a1_1_pronunciation"},{"dimension":"discourse","node_id":"kg_a1_1_discourse"},{"dimension":"pragmatics","node_id":"kg_a1_1_pragmatics"},{"dimension":"collocations","node_id":"kg_a1_1_collocations"},{"dimension":"lexical_chunks","node_id":"kg_a1_1_lexical_chunks"},{"dimension":"topics","node_id":"kg_a1_1_topics"},{"dimension":"skills","node_id":"kg_a1_1_skills"}],"packet_id":"a1full-packet-01","packet_sha256":"8ebe4d1f70cae5639e69865662213ffe40eeb8a8aee0e0e796b2f24fb05dc4fa","practice":{"listening":{"answer":"Lan","constraints":["Do not reveal the transcript before the learner answers.","Ask exactly one comprehension question before showing the transcript.","Use only the supplied project-authored transcript."],"goal":"Understand one clear detail in a short exchange about hello and goodbye.","instruction":"Listen once without reading to a short exchange about hello and goodbye. Answer the question, then ask to see the transcript and listen again.","media_required":false,"question":"What is the speaker's name?","target_ids":["a1t_u01_social_greetings"],"transcript":"Hi, I'm Lan. Nice to meet you."},"pronunciation":{"constraints":["Assess pronunciation only when learner audio is available.","Return NOT_ASSESSED when no audio is supplied.","Give one observable sound, stress, or rhythm point rather than general pronunciation advice."],"goal":"Produce the identified sound, stress, or rhythm feature clearly in a useful phrase.","instruction":"Read the concrete sound target aloud: Word stress: HEL-lo. Clap once on HEL, then say hello smoothly. Then read one lesson sentence slowly and once at normal speed.","target":"Word stress: HEL-lo. Clap once on HEL, then say hello smoothly.","target_ids":["a1t_u01_social_greetings"],"without_audio":"NOT_ASSESSED"},"speaking":{"constraints":["Give the tutor one role and the learner one role before the first turn.","Create an information gap: the tutor asks for one missing personal or practical detail.","Use no more than three tutor turns and give one correction only if it blocks meaning.","Finish after the learner has used the target and responded to one follow-up."],"goal":"Complete a short, understandable exchange about hello and goodbye.","instruction":"Roleplay: you are a learner using hello and goodbye; the tutor is a helpful conversation partner. Scenario: you need to use this language in a short everyday interaction. Tutor opening: “Hello. Can we practise hello and goodbye?” Reply naturally, ask or answer one follow-up question, and finish the exchange politely. Useful model: Hello, I am Lan.","target_ids":["a1t_u01_social_greetings"]},"writing":{"constraints":["Wait for the learner draft before feedback.","Give at most two brief improvement points about meaning, word order, or target use.","Do not replace the learner draft with a complete rewritten answer."],"feedback_boundary":"FEEDBACK_ONLY_NO_REPLACEMENT","goal":"Produce a short A1 message about hello and goodbye with a clear meaning.","instruction":"Write 2–3 short sentences for a real-life situation about hello and goodbye. Include one sentence pattern from this lesson, then add one true or invented detail. Do not copy this model exactly: Hello, I am Lan. Submit your draft first.","target_ids":["a1t_u01_social_greetings"]}},"prerequisite_lesson_ids":[],"provenance":{"allocation_sha256":"89223f95e61232e9261600c67021daa8328604cee89c9ad2b011368c1e035bda","blueprint_sha256":"9b993df9715ec8d4e75bed9458830b7e010e853bfac59894f8124359651fad17","content_manifest_sha256":"a4330865f885fa1b2074d4176f3b9470f3f3b82f56e792b061caad6e6782bed8","content_origin":"PROJECT_AUTHORED","content_unit_sha256":"594edca4c4cbda0e867d00f0028c4c01794bd85b8c1271ada73aa9299b1a0128","population_sha256":"04316d931c16ce32e90dbfed123c8fd9d85fb3b01c4e1e22f310a672bfae9ea1"},"record_type":"a1_full_packet","schema_version":"2.0","sequence":1,"target_usage":[{"target_id":"a1t_u01_social_greetings","usage":"INTRODUCE"}],"tier":"A1.1","title":"Hello and goodbye","topic":"social greetings","unit_id":"m16a1-v1-a1-u01"}
