{"allowed_exercise_types":["reading","matching","speaking"],"content_sections":[{"body":"Use this lesson language to communicate a simple real-life meaning: Build do and does questions about familiar routines. Model: “Does Mai walk to work? Yes, she does.” Notice the important words and the word order. Mẹo tiếng Việt: hãy hiểu ý của cả câu trước, rồi nói theo cụm ngắn; không cần dịch từng từ.","id":"form-and-meaning","section_type":"explanation","target_ids":["a1t_u06_present_simple_questions","a1t_u06_present_simple_statements"],"title":"Form and meaning"},{"body":"Read this short situation. A learner needs to use questions about routines clearly and politely. One useful response is: “Does Mai walk to work? Yes, she does.” Say the model once, then change one safe detail such as a name, place, time, colour, or item when the meaning allows.","id":"guided-context","section_type":"dialogue","target_ids":["a1t_u06_present_simple_questions","a1t_u06_present_simple_statements"],"title":"Guided context"},{"body":"Practise for meaning, not only for memory. Imagine one everyday situation where questions about routines is useful. First use the model, then make one small change. Check: Is the message clear? Is the target language in the right place? Can another person answer you?","id":"use-it","section_type":"review","target_ids":["a1t_u06_present_simple_questions","a1t_u06_present_simple_statements"],"title":"Use it"}],"content_status":"UNREVIEWED","duration_minutes":30,"exercises":[{"id":"detail-check","media_required":false,"prompt":"Read the short message and answer the question about questions about routines.","questions":[{"acceptable_answers":["she walks"],"question":"How does Mai travel to work?"}],"stimulus":"Does Mai walk to work? Yes, she does.","target_ids":["a1t_u06_present_simple_questions"],"type":"reading"},{"id":"form-match","media_required":false,"pairs":[{"left":"Does Mai walk to work? Yes, she does.","right":"A model sentence for questions about routines."},{"left":"Questions About Routines","right":"The everyday situation for this lesson."}],"prompt":"Match each useful English expression with its practical use in questions about routines.","target_ids":["a1t_u06_present_simple_questions"],"type":"matching"},{"id":"personal-response","media_required":false,"prompt":"Make a short, personal response about questions about routines. Use the lesson language and add one detail that is yours.","rubric":{"criteria":["The response communicates a clear meaning about questions about routines.","The response uses the allocated language in an understandable form.","The response adds an appropriate personal or invented detail."]},"target_ids":["a1t_u06_present_simple_questions","a1t_u06_present_simple_statements"],"type":"speaking"}],"language_focus":"Build do and does questions about familiar routines.","lesson_id":"m16a1-v1-a1-u06-l02","objective_target_ids":["a1t_u06_present_simple_questions","a1t_u06_present_simple_statements"],"objectives":["Build do and does questions about familiar routines.","Use present simple questions in one short, clear everyday exchange."],"outline_targets":[{"dimension":"grammar","node_id":"kg_a1_2_grammar"},{"dimension":"vocabulary_senses","node_id":"kg_a1_2_vocabulary_senses"},{"dimension":"functions","node_id":"kg_a1_2_functions"},{"dimension":"pronunciation","node_id":"kg_a1_2_pronunciation"},{"dimension":"discourse","node_id":"kg_a1_2_discourse"},{"dimension":"pragmatics","node_id":"kg_a1_2_pragmatics"},{"dimension":"collocations","node_id":"kg_a1_2_collocations"},{"dimension":"lexical_chunks","node_id":"kg_a1_2_lexical_chunks"},{"dimension":"topics","node_id":"kg_a1_2_topics"},{"dimension":"skills","node_id":"kg_a1_2_skills"}],"packet_id":"a1full-packet-27","packet_sha256":"0c92dd22de7a19baa9130f13216f0727713b32b058aa76ed09bb09d9cf44c561","practice":{"listening":{"answer":"No","constraints":["Do not reveal the transcript before the learner answers.","Ask exactly one comprehension question before showing the transcript.","Use only the supplied project-authored transcript."],"goal":"Understand one clear detail in a short exchange about questions about routines.","instruction":"Listen once without reading to a short exchange about questions about routines. Answer the question, then ask to see the transcript and listen again.","media_required":false,"question":"Does the speaker work on Saturday?","target_ids":["a1t_u06_present_simple_questions","a1t_u06_present_simple_statements"],"transcript":"Do you work on Saturday? No, I don't. I study at home."},"pronunciation":{"constraints":["Assess pronunciation only when learner audio is available.","Return NOT_ASSESSED when no audio is supplied.","Give one observable sound, stress, or rhythm point rather than general pronunciation advice."],"goal":"Produce the identified sound, stress, or rhythm feature clearly in a useful phrase.","instruction":"Read the concrete sound target aloud: Link do you; make does sound /dʌz/ in does questions. Then read one lesson sentence slowly and once at normal speed.","target":"Link do you; make does sound /dʌz/ in does questions.","target_ids":["a1t_u06_present_simple_questions","a1t_u06_present_simple_statements"],"without_audio":"NOT_ASSESSED"},"speaking":{"constraints":["Give the tutor one role and the learner one role before the first turn.","Create an information gap: the tutor asks for one missing personal or practical detail.","Use no more than three tutor turns and give one correction only if it blocks meaning.","Finish after the learner has used the target and responded to one follow-up."],"goal":"Complete a short, understandable exchange about questions about routines.","instruction":"Roleplay: you are a learner using questions about routines; the tutor is a helpful conversation partner. Scenario: you need to use this language in a short everyday interaction. Tutor opening: “Hello. Can we practise questions about routines?” Reply naturally, ask or answer one follow-up question, and finish the exchange politely. Useful model: Does Mai walk to work? Yes, she does.","target_ids":["a1t_u06_present_simple_questions","a1t_u06_present_simple_statements"]},"writing":{"constraints":["Wait for the learner draft before feedback.","Give at most two brief improvement points about meaning, word order, or target use.","Do not replace the learner draft with a complete rewritten answer."],"feedback_boundary":"FEEDBACK_ONLY_NO_REPLACEMENT","goal":"Produce a short A1 message about questions about routines with a clear meaning.","instruction":"Write 2–3 short sentences for a real-life situation about questions about routines. Include one sentence pattern from this lesson, then add one true or invented detail. Do not copy this model exactly: Does Mai walk to work? Yes, she does. Submit your draft first.","target_ids":["a1t_u06_present_simple_questions","a1t_u06_present_simple_statements"]}},"prerequisite_lesson_ids":["m16a1-v1-a1-u06-l01"],"provenance":{"allocation_sha256":"89223f95e61232e9261600c67021daa8328604cee89c9ad2b011368c1e035bda","blueprint_sha256":"9b993df9715ec8d4e75bed9458830b7e010e853bfac59894f8124359651fad17","content_manifest_sha256":"a4330865f885fa1b2074d4176f3b9470f3f3b82f56e792b061caad6e6782bed8","content_origin":"PROJECT_AUTHORED","content_unit_sha256":"5a5ad139c8e9d7c459cb59bb35f39f7f018633b5dd33ad42cae105ea948f74d8","population_sha256":"04316d931c16ce32e90dbfed123c8fd9d85fb3b01c4e1e22f310a672bfae9ea1"},"record_type":"a1_full_packet","schema_version":"2.0","sequence":27,"target_usage":[{"target_id":"a1t_u06_present_simple_questions","usage":"INTRODUCE"},{"target_id":"a1t_u06_present_simple_statements","usage":"PRACTISE"}],"tier":"A1.2","title":"Questions about routines","topic":"present simple questions","unit_id":"m16a1-v1-a1-u06"}
